{
  "format": 1,
  "sourceCommit": "b2815314182221baac6b08750f86ef2644d2cdb8",
  "cmsSha256": "c2fe582a14ff6e79620b232ca7ffc914afb0474ec21fd43f208251dd7252f4a3",
  "packages": [
    {
      "name": "@get-modular/core",
      "version": "0.6.0",
      "file": "archives/get-modular-core-0.6.0.tgz",
      "sha256": "bac6f9e899b235124faf9d8eea9842eaaba5bb1ba543adb626fe21d6e3a5870f"
    },
    {
      "name": "@get-modular/assembly",
      "version": "0.6.0",
      "file": "archives/get-modular-assembly-0.6.0.tgz",
      "sha256": "ac96072e21d7a6a4264685c25e8c5ee487cbe0302ede58ec384d34ad4ddf8f63"
    },
    {
      "name": "@get-modular/resources",
      "version": "0.2.0",
      "file": "archives/get-modular-resources-0.2.0.tgz",
      "sha256": "d9f6363d9c848be90c15e5d20acf07226e3b29ed55ae8af3d6ee0274e5a123d5"
    },
    {
      "name": "@get-modular/conformance",
      "version": "0.4.0",
      "file": "archives/get-modular-conformance-0.4.0.tgz",
      "sha256": "9b0b7c3bd1f64ebed48ddf6ac51782aab0cf70d72a1fb9fac99b591b3ade888b"
    },
    {
      "name": "@get-modular/observation",
      "version": "0.1.0",
      "file": "archives/get-modular-observation-0.1.0.tgz",
      "sha256": "3a3f235336fdeecf6a54b99c3585afd3440dd0f9cab03d99af043f38bf433597"
    }
  ]
}
